issue_id,commit_id,p_x,l_x,issue_desc,issue_comments,summary,files,created_at,closed_at,commit_time
101,149f24e74104b324b62326453e7cbe12b53a5f5a,3.008312319252582e-07,1,"Will not be merged as-is currently , please remove empty sections from your respective areas if no documentation will be provided .",Usage + architecture + maintenance documentation,Merge pull request # 101 from Project-C-SQL/feat/maintenance-plan,"['docs/architecture.jpg', 'docs/architecture.md', 'docs/index.rst', 'docs/interfaces.md', 'docs/maintenance-plan.md', 'docs/pg4n.md', 'docs/program-architecture.md']",2022-12-16 10:43:17+00:00,2022-12-16 16:54:09+00:00,2022-12-16 18:54:08+02:00
102,f3289740648ca885a1b843623ce26ede02099f61,9.995272165497229e-08,1,Makes disabling of warnings in configuration actually disable the warnings,Fix/config eval,Merge pull request # 102 from Project-C-SQL/fix/config-eval,"['src/pg4n/main.py', 'src/pg4n/semanticrouter.py', 'src/pg4n/sum_distinct_checker.py']",2022-12-16 13:33:59+00:00,2022-12-16 16:16:25+00:00,2022-12-16 18:16:25+02:00
84,0499f91bd01fde04e830476f7024c376a5bbedfb,1.1655424181356013e-08,1,,Adds missing config values and a script generating those,Merge pull request # 84 from Project-C-SQL/fix/missing-checkers,"['scripts/gen_config_values.bash', 'src/pg4n/cmp_domain_checker.py', 'src/pg4n/config_values.py', 'src/pg4n/eq_wildcard_checker.py', 'src/pg4n/implied_expression_checker.py', 'src/pg4n/semanticrouter.py', 'src/pg4n/strange_having_checker.py', 'src/pg4n/subquery_order_by_checker.py', 'src/pg4n/subquery_orderby_checker.py', 'src/pg4n/subquery_select_checker.py', 'src/pg4n/sum_distinct_checker.py', 'src/pg4n/test/test_config_parser.py', 'src/pg4n/test/test_subquery_order_by_checker.py', 'src/pg4n/test/test_subquery_orderby_checker.py']",2022-11-22 10:11:08+00:00,2022-11-25 11:51:14+00:00,2022-11-25 13:51:14+02:00
85,33120fdaf85b81b29fda0b164e51a4d43a477810,1.1743986760848203e-07,1,Fixes # 54,Add constant deployment,Merge pull request # 85 from Project-C-SQL/feat/cd-publish,"['.github/workflows/ci-cd.yml', '.github/workflows/grade.yml', '.github/workflows/pytest.yml', '.github/workflows/sphinx.yml', 'README.md', 'pyproject.toml', 'scripts/cd-publish.sh']",2022-11-22 10:17:45+00:00,2022-11-22 15:15:01+00:00,2022-11-22 17:15:00+02:00
82,df74a04e21b67c5d76e8467383b4146ed643743a,0.0013042569626122,1,,"Added pyparsing to dependencies , updated version & authors .",Merge pull request # 82 from Project-C-SQL/fix/pyproject-pyparsing,"['poetry.lock', 'pyproject.toml']",2022-11-21 15:35:44+00:00,2022-11-21 21:29:09+00:00,2022-11-21 23:29:08+02:00
49,6830527819fcd57d7a932bcff1557c4ff64d5440,3.6419578464119695e-06,1,"Wrapper has 2 significant bugs left : - parse multiline queries properly ( ` db= > SELECT db- > db- > * FROM orders ; ` ) - separate queries properly ( ` db= > SELECT * FROM orders ; db= > INSERT INTO queries VALUES ( 6,6,6 ) ; ` should not parse as ` SELECT * FROM orders ; db= > INSERT INTO queries VALUES ( 6,6,6 ) ; ` ) due to lazily sticking to SELECT as the delimiter .","Multiline queries , detect separate queries",Fixes # 49 . Polishing parser and wrapper .,"['src/pg4n/psqlparser.py', 'src/pg4n/psqlwrapper.py', 'src/pg4n/test/test_psqlparser.py', 'src/pg4n/test/test_psqlwrapper.py']",2022-11-04 15:31:55+00:00,2022-11-21 14:23:46+00:00,2022-11-19 17:44:08+02:00
60,8b9c3dad56fe0a5070bd3d546b468f4bba27275a,0.0037020924501121,1,,Bug fixes .,Merge pull request # 60 from Project-C-SQL/fix/demoday,"['src/pg4n/psqlparser.py', 'src/pg4n/semanticrouter.py', 'src/pg4n/sqlparser.py']",2022-11-08 08:51:54+00:00,2022-11-08 08:54:19+00:00,2022-11-08 10:54:19+02:00
53,aebf426ab3350d922e78442db19398914f4610aa,0.0065218131057918,1,A quick & dumb implementation that serves # 34 's aims but does not really implement it .,Feat/semantic router,Merge pull request # 53 from Project-C-SQL/feat/semantic-router,"['src/pg4n/main.py', 'src/pg4n/psqlconninfo.py', 'src/pg4n/psqlparser.py', 'src/pg4n/psqlwrapper.py', 'src/pg4n/semanticrouter.py', 'src/pg4n/test/test_psqlparser.py', 'src/pg4n/test/test_psqlwrapper.py']",2022-11-06 15:11:32+00:00,2022-11-07 18:09:03+00:00,2022-11-07 20:09:02+02:00
45,384f6bc82083044b78ca8730d99ba7b0d48e61d1,0.0003013004024978,1,Current implementation uses hardcoded parameters for these . Pexpect could be used to get at least the username . It could be that we will have to analyse the command-line arguments or environmental variables for other parameters .,"Pass real PostgresSQL username , port , host , and password to psycopg",Get connection information via psql for psycopg . # 45,['src/pg4n/psqlconninfo.py'],2022-11-03 10:08:27+00:00,2022-11-07 07:42:45+00:00,2022-11-06 16:27:06+02:00
51,67a44d6dcf82358abcf699c347b79c06a6c74dbe,2.54540054811514e-07,1,Closes # 42,Add black and pylint runs to CI/CD,Merge pull request # 51 from Project-C-SQL/feat/add-linter,"['.github/actions/install/action.yml', '.github/workflows/ci-flow.yml', '.github/workflows/pr_flow.yml', '.github/workflows/pytest.yml', '.github/workflows/sphinx.yml', 'README.md', 'docs/_static/github-mark.svg', 'docs/_templates/footer.html', 'docs/conf.py', 'docs/program-architecture.md', 'poetry.lock', 'pyproject.toml', 'scripts/ci-grade.sh']",2022-11-04 15:35:29+00:00,2022-11-06 12:04:38+00:00,2022-11-06 14:04:38+02:00
46,1d78bdd62aa8b991c2c3745bb94b8d983f0a0f27,0.000634237891063,1,"Adds detection and warning message generation of suspicious comparisons from different domains e.g. , a : VARCHAR ( 20 ) < b : VARCHAR ( 50 ) . brass_2005.pdf : :e31",Feat/cmp domain,Merge pull request # 46 from Project-C-SQL/feat/cmp-domain,"['src/pg4n/cmp_domain_checker.py', 'src/pg4n/sqlparser.py', 'src/pg4n/test/test_cmp_domain_checker.py']",2022-11-03 13:10:08+00:00,2022-11-04 14:51:56+00:00,2022-11-04 16:51:55+02:00
37,54913a5f42184078d70e9407b264ba0faf648309,5.749650089370561e-09,1,qepparser needs to use SET constraint_exclusion = 'on ' before doing its queries . This makes # 6 trivial search for One-Time Filter 's from the QEP .,constraint_exclusion option for qepparser,Fix # 37,"['src/pg4n/qepparser.py', 'src/pg4n/test/test_qepparser.py']",2022-10-25 08:51:21+00:00,2022-11-05 11:28:49+00:00,2022-11-02 23:42:42+02:00
27,6c63c9c09f6fcbf373797aa2b0b7adb7b9c4259a,3.212664159946144e-05,1,Related to # 5,"Create FSM for interpreting control codes induced by e.g . up-/down-arrows , ctrl-R and backspace","Refined , but still fragile , implementation of # 27","['src/pg4n/psqlparser.py', 'src/pg4n/psqlwrapper.py', 'src/pg4n/vt100decode.py']",2022-10-07 08:29:54+00:00,2022-11-06 14:07:53+00:00,2022-10-21 19:44:17+03:00
27,9f73e1f72de3bcc8fdf9e46908933281fa54178d,1.049741172209906e-06,1,Related to # 5,"Create FSM for interpreting control codes induced by e.g . up-/down-arrows , ctrl-R and backspace",Prototype implementation for # 27,"['src/pg4n/psqlparser.py', 'src/pg4n/psqlwrapper.py', 'src/pg4n/vt100decode.py']",2022-10-07 08:29:54+00:00,2022-11-06 14:07:53+00:00,2022-10-19 18:05:06+03:00
31,576ff1d3f49e6180a05f05e0e2ae13ba93d7ecb4,0.0002872032637242,1,"Closes # 15 Adds Poetry for packaging and dependency management . Add GitHub Actions with caching , postgres , pytest , sphinx , and gh-pages . Fix using ` psycopg2 ` ( ` psycopg ` is newer ) . Fix import syntaxes . Move source files to ` src/ ` . Add notes for developers to README .",Incorporate GitHub Actions and GitHub Pages,Merge pull request # 31 from Project-C-SQL/feat/add-docs,"['.github/workflows/ci-flow.yml', '.gitignore', 'README.md', 'docs/architecture.md', 'docs/conf.py', 'docs/index.rst', 'docs/interfaces.md', 'docs/program-architecture.md', 'main.py', 'orderby.py', 'poetry.lock', 'psqlparser.py', 'psqlwrapper.py', 'pyproject.toml', 'qepparser.py', 'sqlparser.py', 'src/pg4n/__init__.py', 'src/pg4n/main.py', 'src/pg4n/orderby.py', 'src/pg4n/psqlparser.py', 'src/pg4n/psqlwrapper.py', 'src/pg4n/qepparser.py', 'src/pg4n/sqlparser.py', 'src/pg4n/test/__init__.py', 'src/pg4n/test/test_qepparser.py', 'src/pg4n/util.py', 'test_qepparser.py']",2022-10-12 22:33:45+00:00,2022-10-13 09:22:39+00:00,2022-10-13 12:22:38+03:00
5,03b8f57227ebc9ade474cca05e17349fa4eed649,8.309162780051339e-08,1,"Doing : Ctrl-R SELE and selecting : SELECT * FROM orders WHERE order_total_eur = 0 AND order_total_eur = 1 ; leads the wrapper to send `` = > SELE '' as the statement , even if the whole statement can be found in the program output log . Requires work on the wrapper parser .",Supporting Ctrl-R requires a more extensive parser,"Final commit for this branch . Could n't resolve # 5 , a new branch will be in order for # 27 .","['main.py', 'psqlparser.py', 'psqlwrapper.py']",2022-09-23 11:16:03+00:00,2022-10-08 10:35:35+00:00,2022-10-07 12:37:09+03:00
4,deb3a2a40e7985cd361fcd18ccfebab53b113d71,5.725315531890374e-06,1,Implements # 3,A basic wrapper module and an entry point to the program,Merge pull request # 4 from Project-C-SQL/feat/pexpect-wrapper,"['main.py', 'wrapper.py']",2022-09-23 10:47:55+00:00,2022-09-25 06:01:08+00:00,2022-09-25 06:01:08+00:00
